บ้านและสวน,บ้านและสวน.jpeg,บ้านและสวนแฟร์ งานบ้านที่ใหญ่ที่สุด งานแสดงและขายสินค้าครบวงจรที่เกี่ยวกับบ้านและสวน ทั้งในเชิง design and living รวมทั้งนิทรรศการและกิจกรรมให้ความรู้ข่าวสารเกี่ยวกับที่อยู่อาศัย,บ้านและของแต่งบ้าน,BITEC - Bangkok International Trade & Exhibition Centre,2023-10-05,2023-10-14,09:00,20:00,ice,-1,null,null,null,null,16aa5209-4332-4907-b639-efcec6218f9a
คอมมาร์ท 2023,คอมมาร์ท 2023.jpeg,งานคอมมาร์ทที่รวมสินค้าคอมพิวเตอร์ไว้มากมาย พร้อมโปรโมชั่น ลด แลก แจก แถม ลดราคากระหน่ำ,งานแสดงสินค้า,ไบเทค บางนา,2023-10-08,2023-10-18,09:00,20:00,1,-1,null,null,null,null,e90bb7e6-0843-484a-9326-ae4fec4ef020
A clay ceramic,A clay ceramic.jpg,เริ่มต้นที่แรก เป็นร้านสอนปั้นเซรามิก ที่ตั้งอยู่แถวสาทร ภายในร้านตกแต่งอย่างน่ารัก ส่วนคอร์ส Workshop ก็มีให้เราเลือกหลายคอร์สเลย แล้วแต่ว่าเราสะดวกแบบไหน มีทั้งแบบ 1 วัน และ 2 วัน...ใครที่อยากมาทำเซรามิคของตัวเองหรืออยากทำไปฝากคนรัก ครอบครัว ก็มาทำกันได้เลย สนุกแถมได้เซรามิกน่ารักๆ กลับไปด้วย,ศิลปะ/นิทรรศการ/ถ่ายภาพ,50 ซอย สาทร 8 แขวง สีลม เขตบางรัก กรุงเทพมหานคร  (A Clay Cafe ชั้น3) Bts ช่องนนทรี ทางออก2,2023-10-13,2023-10-15,10:00,17:30,ice,6,2023-10-01,2023-10-12,07:00,19:00,a696b071-b826-47d6-bf3f-9b721044f5de
The Planteries,The Planteries.jpeg,เวิร์กชอปปั้นดินสี เพ้นท์กระถาง สร้างช่วงเวลาพิเศษสุดครีเอทีฟกับคุณแม่ไปด้วยกัน จะปั้นเป็นอะไรก็ได้หมด! แล้วแต่ใจคุณแม่เลย ทำเสร็จแล้วยังได้ชิ้นงานแบบ Handmade ที่ unique สุดๆ กลับบ้านไปอีกด้วย ที่นี่ยังมีเวิร์กชอปอื่นๆ อีกไม่ว่าจะเป็น เพ้นท์กระถาง หรือทำเทียนหอม,ศิลปะ/นิทรรศการ/ถ่ายภาพ,The Planteries พระราม 9 (ซอยรามคำแหง 24 แยก 20),2023-11-04,2023-11-05,10:00,19:00,Solomon,10,null,null,null,null,2255983a-080e-49fb-ae25-8fb5c528615d
ทำบ้านปลา เก็บขยะชายหาด,ทำบ้านปลา เก็บขยะชายหาด.jpeg,กิจกรรมทำบ้านปลา @ หมู่บ้านประมงบางปู จ.ประจวบคีรีขันธ์ กิจการเพื่อสังคม จัดค่ายกิจกรรม อบรม สัมมนา ศึกษาดูงาน และทริปท่องเที่ยวเชิงอนุรักษ์ โดยเน้นสนับสนุนชุมชน ให้ชาวบ้านมีรายได้ หากคนพื้นที่อยู่ได้ ทรัพยากรธรรมชาติก็จะอยู่ได้อย่างยั่งยืน งบประมาณที่เหลือจากการจัดกิจกรรม,อื่น ๆ,@ หมู่บ้านประมงบางปู – หาดแหลมศาลา - ถ้ำพระยานคร อุทยานแห่งชาติเขาสามร้อยยอด จ.ประจวบคีรีขันธ์,2023-09-26,2023-09-26,06:30,18:00,nanami,40,null,null,null,null,246db5aa-7f91-4491-84ca-08baf4d98686
งานหนังสือ 2566,งานหนังสือ 2566.jpeg,งานสัปดาห์หนังสือ 2566 เดือนตุลาคม (Book Expo Thailand 2023) หรือมหกรรมหนังสือระดับชาติครั้งที่ 28 เริ่มขึ้นอีกครั้งในเดือนตุลาคมปีนี้ สำหรับใครที่เตรียมเดินทางไปเลือกซื้อหนังสือ อย่าลืมเช็กวันจัดงาน เวลาเปิด-ปิดงานหนังสือให้ดี เพราะวันธรรมดาและวันหยุดมีเวลาที่แตกต่างกัน,งานแสดงสินค้า,ศูนย์การประชุมแห่งชาติสิริกิติ์,2023-10-12,2023-10-23,10:00,23:00,ice,-1,,,,,80ff809d-2d54-40b9-8afc-63658420f3af
